{
  "$schema": "https://json-schema.org/draft/2020-12/schema",
  "$id": "https://libby.local/schema/profile.schema.json",
  "title": "Libby case profile (scrubbed, committable)",
  "description": "Derived non-identifying snapshot of a single patient case. Generated by the intake agent and validated by promote_profile.py before entering data/.",
  "type": "object",
  "additionalProperties": false,
  "required": [
    "case_slug",
    "age_band",
    "sex",
    "primary_site",
    "biomarkers",
    "stage",
    "ecog",
    "prior_therapies",
    "targetable_features"
  ],
  "properties": {
    "case_slug": {
      "type": "string",
      "pattern": "^[a-z0-9]+(?:-[a-z0-9]+)*$",
      "description": "Kebab-case clinical-descriptor slug; must not be patient-initials or birthdate-shaped."
    },
    "age_band": {
      "type": "string",
      "enum": ["<18", "18-29", "30-39", "40-49", "50-59", "60-69", "70-79", "80+"]
    },
    "sex": {
      "type": "string",
      "enum": ["female", "male", "intersex", "unknown"]
    },
    "primary_site": {
      "type": "string",
      "description": "Anatomic site (e.g. 'lung', 'colorectal', 'breast'). Not a diagnosis date."
    },
    "histology": {
      "type": "string",
      "description": "Histologic subtype (e.g. 'adenocarcinoma', 'squamous')."
    },
    "biomarkers": {
      "type": "array",
      "items": {
        "type": "object",
        "additionalProperties": false,
        "required": ["name", "value"],
        "properties": {
          "name": { "type": "string" },
          "value": { "type": "string" },
          "method": { "type": "string" }
        }
      }
    },
    "stage": {
      "type": "string",
      "description": "Clinical stage (e.g. 'IV', 'III')."
    },
    "ecog": {
      "type": "integer",
      "minimum": 0,
      "maximum": 4
    },
    "prior_therapies": {
      "type": "array",
      "items": {
        "type": "object",
        "additionalProperties": false,
        "required": ["regimen", "best_response"],
        "properties": {
          "regimen": { "type": "string" },
          "line": { "type": "string", "description": "e.g. '1L', '2L', 'adjuvant'." },
          "best_response": {
            "type": "string",
            "enum": ["CR", "PR", "SD", "PD", "NE", "unknown"]
          },
          "duration_months": { "type": "number", "minimum": 0 }
        }
      }
    },
    "current_therapy": {
      "type": ["string", "null"],
      "description": "Free text — what the patient is on at intake, or null."
    },
    "organ_function": {
      "type": "object",
      "additionalProperties": { "type": ["number", "string"] },
      "description": "Lab values as numerics or qualitative tiers (e.g. 'CrCl_ml_min': 78, 'AST_U_L': 32)."
    },
    "targetable_features": {
      "type": "array",
      "minItems": 1,
      "items": {
        "type": "object",
        "additionalProperties": false,
        "required": ["feature", "rationale"],
        "properties": {
          "feature": { "type": "string", "description": "User-supplied targetable feature." },
          "rationale": { "type": "string" }
        }
      }
    },
    "geography_band": {
      "type": ["string", "null"],
      "description": "Country or US census region — never ZIP / city / hospital name.",
      "examples": ["US-Northeast", "US-South", "EU", "UK"]
    },
    "private": {
      "type": "boolean",
      "default": false,
      "description": "If true, do not generate public docs/cases/<slug>/ pages — keep local-only."
    }
  }
}
